{
  "taskId": "TASK-0001",
  "state": "ACCEPTED",
  "baseCommit": "85cc7393957bc8840207fabce25395dd9bad62bd",
  "headCommit": "3b43a1b418872e5ea428732bc79d26abcb632af2",
  "evidencePath": "docs/evidence/TASK-0001/evidence-pack.json",
  "completed": [
    "V0.3.1 起步包已作为独立 main 分支基线保存",
    "产品方案和技术架构原文已按原始 SHA-256 复制到 docs/source",
    "Java 25、Spring Boot 4.1.0、Spring AI 2.0.0、Spring Modulith 2.1.0 技术基线已锁定",
    "Catalog 编译模块与 Spring Boot Runtime 骨架已建立",
    "健康检查与只读内部基线端点已实现并验证",
    "uni-app Vue 3 TypeScript Pinia H5 骨架已建立并联调",
    "GitHub Actions、Maven Wrapper、Windows/WSL 开发脚本已建立",
    "Evidence Pack、验证摘要和可恢复 Handoff 已生成",
    "私有 GitHub 仓库已连接，main 已推送并建立 origin 跟踪",
    "GitHub Actions 首次环境差异已前向修复，Catalog/Harness、Backend、Frontend 全部通过"
  ],
  "remaining": [
    "创建独立 Harness READY 任务修复 Windows 换行漂移与缺失的 Catalog/Contract Skill",
    "创建首个业务纵切 READY 任务，不在 TASK-0001 中继续扩展业务"
  ],
  "knownRisks": [
    "Windows 原生 Catalog drift 存在 CRLF/LF 误报，当前以 WSL2/Linux 门禁为准",
    "catalog-change 与 contract-change Skill 缺失会阻塞后续受保护真源修改",
    "Mockito 动态 Agent 在未来 JDK 中将需要显式配置",
    "当前系统没有用户、聊天、数据库、模型、记忆或安全业务能力，不能开放真实用户"
  ],
  "nextAction": "创建首个业务纵切 READY 任务；如需先处理治理债务，则单独创建 Harness READY 任务。"
}
