{
  "taskId": "TASK-0178",
  "state": "ACCEPTED",
  "baseCommit": "a8db88c2d3a62606823f45e11410faf924ffcd12",
  "headCommit": "0000000000000000000000000000000000000000",
  "evidencePath": "docs/evidence/TASK-0178/evidence-pack.json",
  "completed": [
    "RelationshipService（新，platform.persistence）：包 V9 SD——create_relationship/list_relationships/get_relationship/activate_relationship/deactivate_relationship；activate 先 get 判存在（empty→Optional.empty），deactivate false→empty，NOT_FOUND_OR_FORBIDDEN 语义。",
    "RelationshipRecord（新）+ RelationshipController（新，runtime.relationship.web）：5 端点 POST/GET /api/v1/relationships、GET+POST /{id}、POST /{id}/deactivate；@AuthenticationPrincipal(expression=accountId)；parseId；DTO CreateRelationshipRequest(@NotBlank @Size(max=128) personaRef)+RelationshipResponse(relationshipId,personaRef,active,createdAt)。",
    "runtime.web 共享错误层（新）：ResourceNotFoundException+ErrorEnvelope(record code+message)+RuntimeApiExceptionHandler（404 NOT_FOUND_OR_FORBIDDEN / 400 INVALID_REQUEST 含校验异常）。Modulith 禁止 web→auth 未暴露类型依赖且 auth/web/** 保护不可改 → ErrorEnvelope 独立于 auth 模块，wire 格式与 OpenAPI 一致。",
    "AuthDataSourceConfig + RelationshipService bean；Controller 组件扫描注册（@ConditionalOnProperty auth.datasource-enabled=true，与 Generation/ConversationController 同模式）。",
    "测试：RelationshipServiceTest 7（SD SQL 精确+RowMapper+empty 语义）+ RelationshipControllerTest 10（happy path×5+404×3+400×2，standalone MockMvc+Principal resolver）；RuntimeModuleStructureTest Modulith PASS。",
    "不新增 DB migration、不改 modelruntime/safety/adapters/specs/auth 包（只消费 V9 SD 公共函数）→ 不触发 C3 model-routing-change / C4 database-migration；卡片定 C2。"
  ],
  "remaining": [
    "TASK-0179：listMessages（GET /api/v1/conversations/{id}/messages，V10 list_messages）+ cancelGeneration（POST /api/v1/generations/{id}/cancel，V10 cancel_generation）HTTP 端点。",
    "memory HTTP 端点（createMemoryCandidate/listMemories/get/update/delete/confirm/reject/evidence，OpenAPI 已定义，V11/V12/V13 SD 已就绪）。",
    "TASK-0180+：create_authorization_snapshots SD 函数（C4 migration）+ AuthorizationSnapshotProvider JDBC 实现 + loopback adapter e2e；realtime SSE 推送；ID hashid 编码。"
  ],
  "knownRisks": [
    "authorizationCommit 为占位符字符串（精简长线流残留，历史不可改写；doctor ACCEPTED 态不校验该格式），与 TASK-0173..0177 同属已知残留。",
    "ErrorEnvelope 在 runtime.web 与 auth.web 各有一份同构 record：Modulith 应用结构禁止 web 模块依赖 auth 未暴露类型，auth/web/** 是保护路径不可加 exposes；wire 格式（code+message）与 OpenAPI 契约一致，无第二套 wire 语义。",
    "DTO id 仍为 long（OpenAPI relationshipId 是 string；long 序列化为数字字符串，与 TASK-0174 的 generationId 一致）；hashid 编码 deferred。",
    "canonical precheck / doctor --summary / 完整 Harness unittest discover / 根级 Maven verify deferred per Owner 2026-08-12 static-gates-only。"
  ],
  "nextAction": "TASK-0178（Relationship HTTP API，C2）闭环 ACCEPTED：实现 OpenAPI 已定义但 Java HTTP 层缺失的 5 个relationship 端点（POST/GET /api/v1/relationships、GET+POST /api/v1/relationships/{id}、POST /{id}/deactivate），复用 V9 SD 函数（create/list/get/activate/deactivate_relationship，均已 GRANT vc_api）；新 RelationshipService(platform.persistence 包 V9)+RelationshipRecord+RelationshipController(runtime.relationship.web，组件扫描+@ConditionalOnProperty auth.datasource-enabled，@AuthenticationPrincipal(expression=accountId))+runtime.web 共享错误层(ResourceNotFoundException/ErrorEnvelope/RuntimeApiExceptionHandler：404 NOT_FOUND_OR_FORBIDDEN 不泄露存在性+400 INVALID_REQUEST；Modulith 禁止 web→auth 未暴露类型依赖故 ErrorEnvelope 独立于 auth 模块，wire 格式不变)+AuthDataSourceConfig 加 RelationshipService bean；DTO id 沿用 long（hashid deferred）；RelationshipServiceTest 7+RelationshipControllerTest 10 场景；run-rls 67/67+mvn runtime 271/0/0+diff exit0 全绿。不新增 migration、不改 modelruntime/safety/adapters/specs/auth 包→不触发 C3/C4。下一步：开 TASK-0179——listMessages（GET /conversations/{id}/messages）+ cancelGeneration（POST /generations/{id}/cancel）端点（V10 SD 已就绪），随后 memory HTTP 端点、C4 snapshot SD 函数+loopback adapter e2e、realtime SSE 推送按序。"
}
